{
  "$schema": "https://json-schema.org/draft/2020-12/schema",
  "$id": "https://ledgermind.dev/schemas/raw-round-v2.schema.json",
  "title": "LedgerMind Raw Round v2",
  "type": "object",
  "additionalProperties": false,
  "required": ["api_version", "idempotency_key", "memory_space_id", "source", "round", "payload_digest"],
  "properties": {
    "api_version": {"const": "2"},
    "idempotency_key": {"type": "string", "pattern": "^sha256:[0-9a-f]{64}$"},
    "memory_space_id": {"type": "string", "minLength": 1, "maxLength": 200},
    "source": {"$ref": "#/$defs/source"},
    "round": {"$ref": "#/$defs/round"},
    "payload_digest": {"type": "string", "pattern": "^sha256:[0-9a-f]{64}$"},
    "extensions": {"$ref": "#/$defs/extensions"}
  },
  "$defs": {
    "extensions": {
      "type": "object",
      "propertyNames": {"pattern": "^[a-z][a-z0-9_.-]*$"},
      "additionalProperties": true,
      "maxProperties": 32
    },
    "content_part": {
      "type": "object",
      "additionalProperties": false,
      "required": ["type"],
      "properties": {
        "type": {"enum": ["text", "json", "reference"]},
        "text": {"type": "string", "maxLength": 200000},
        "data": {},
        "uri": {"type": "string", "maxLength": 2000}
      },
      "allOf": [
        {
          "if": {"properties": {"type": {"const": "text"}}},
          "then": {"required": ["text"]}
        },
        {
          "if": {"properties": {"type": {"const": "json"}}},
          "then": {"required": ["data"]}
        },
        {
          "if": {"properties": {"type": {"const": "reference"}}},
          "then": {"required": ["uri"]}
        }
      ]
    },
    "event": {
      "type": "object",
      "additionalProperties": false,
      "required": ["event_id", "sequence", "kind"],
      "properties": {
        "event_id": {"type": "string", "minLength": 1, "maxLength": 300},
        "sequence": {"type": "integer", "minimum": 0, "maximum": 1000000},
        "kind": {"enum": ["message", "tool_call", "tool_result"]},
        "role": {"enum": ["user", "assistant", "system"]},
        "content": {"type": "array", "items": {"$ref": "#/$defs/content_part"}, "maxItems": 256},
        "final": {"type": "boolean"},
        "tool_call_id": {"type": "string", "minLength": 1, "maxLength": 300},
        "tool_name": {"type": "string", "minLength": 1, "maxLength": 300},
        "arguments": {},
        "status": {"enum": ["success", "error", "cancelled", "unknown"]}
      }
    },
    "source": {
      "type": "object",
      "additionalProperties": false,
      "required": ["system", "instance_id", "profile_id", "session_id", "round_id", "event_ids", "source_schema_version", "adapter_version"],
      "properties": {
        "system": {"type": "string", "minLength": 1, "maxLength": 100},
        "instance_id": {"type": "string", "minLength": 1, "maxLength": 300},
        "profile_id": {"type": "string", "minLength": 1, "maxLength": 300},
        "session_id": {"type": "string", "minLength": 1, "maxLength": 500},
        "round_id": {"type": "string", "minLength": 1, "maxLength": 500},
        "first_event_id": {"type": "string", "minLength": 1, "maxLength": 300},
        "final_event_id": {"type": "string", "minLength": 1, "maxLength": 300},
        "event_ids": {"type": "array", "minItems": 1, "maxItems": 10000, "items": {"type": "string", "minLength": 1, "maxLength": 300}, "uniqueItems": true},
        "source_schema_version": {"type": "integer", "minimum": 1},
        "adapter_version": {"type": "string", "minLength": 1, "maxLength": 200},
        "extensions": {"$ref": "#/$defs/extensions"}
      }
    },
    "round": {
      "type": "object",
      "additionalProperties": false,
      "required": ["started_at", "completed_at", "events"],
      "properties": {
        "started_at": {"type": "string", "format": "date-time"},
        "completed_at": {"type": "string", "format": "date-time"},
        "events": {"type": "array", "minItems": 1, "maxItems": 10000, "items": {"$ref": "#/$defs/event"}}
      }
    }
  }
}
